title,angry,anxious,bark,behavior_category_2,behavior_category_3,behavior_category_5,growl,lick,whine,relevance,scared
dog passed away in nov getting another,False,True,True,True,True,False,False,False,False,False,True
what breed for me,False,True,True,True,True,False,False,False,False,False,True
my good boye went to heaven,False,True,True,True,True,False,False,False,False,False,True
the most dangerous being of all time a violent creature filled with lust for blood,False,True,True,True,True,False,False,False,False,False,True
unique characteristics and traits of pugs,False,True,True,True,True,False,False,False,False,False,True
is my dog suffering are we doing right by euthanizing him tomorrow,False,True,True,True,True,False,False,False,False,False,True
dog sitting  puppy is biting and barking constantly  in need of help  advice,False,True,True,True,True,False,False,False,False,False,True
anyone elses dog do this,False,True,True,True,True,False,False,False,False,True,True
did the vet kill my dog,False,True,True,True,True,False,False,False,False,False,True
choosing a dog breed and taking care of a dog,False,True,True,True,True,False,False,False,False,False,True
i hate him with a passion,False,True,True,True,True,False,False,False,False,False,True
heartbroken,False,True,True,True,True,False,False,False,False,False,True
why does my dog suck,False,True,True,True,True,False,False,False,False,False,True
i buried my friend today,False,True,True,True,True,False,False,False,False,False,True
dog pick up lines,False,True,True,True,True,False,False,False,False,False,True
i miss my dog so much,False,True,True,True,True,False,False,False,False,False,True
spca refused to let me be with my  year old dog during euthanasia legal,False,True,True,True,True,False,False,False,False,False,True
anyone elses dog do this,False,True,True,True,True,False,False,False,False,True,True
dog constantly shows his belly and shakes,False,True,True,True,True,False,False,False,False,True,True
rejected by rescue because i use local dog park,False,True,True,True,True,False,False,False,False,False,True
i hate him with a passion,False,True,True,True,True,False,False,False,False,False,True
heartbroken,False,True,True,True,True,False,False,False,False,False,True
why does my dog suck,False,True,True,True,True,False,False,False,False,False,True
overexcited  year old puppy,False,True,True,True,True,False,False,False,False,False,True
ever increasing anxiety over thunderstorms is taking over my dogs life,False,True,True,True,True,False,False,False,False,False,True
witness a small dog get rolled over by a car and got bit trying to help it,False,True,True,True,True,False,False,False,False,False,True
dog advice,False,True,True,True,True,False,False,False,False,False,True
spca refused to let me be with my  year old dog during euthanasia legal,False,True,True,True,True,False,False,False,False,False,True
dog constantly shows his belly and shakes,False,True,True,True,True,False,False,False,False,True,True
heartbroken,False,True,True,True,True,False,False,False,False,False,True
please help i am really scared,True,False,False,True,False,True,True,True,True,False,False
new puppy adult dog curious about their behavior,False,True,True,True,True,False,False,False,False,False,True
anyone elses dog do this,False,True,True,True,True,False,False,False,False,True,True
dog sitting  puppy is biting and barking constantly  in need of help  advice,False,True,True,True,True,False,False,False,False,False,True
is my dog suffering are we doing right by euthanizing him tomorrow,False,True,True,True,True,False,False,False,False,False,True
new dog owner,False,True,True,True,True,False,False,False,False,False,True
dog sitting  puppy is biting and barking constantly  in need of help  advice,False,True,True,True,True,False,False,False,False,False,True
what dog breeds,False,True,True,True,True,False,False,False,False,False,True
play or fight,True,False,False,True,False,True,True,True,True,False,False
any dog trick recommendations,False,True,True,True,True,False,False,False,False,False,True
enternal love bond,False,True,True,True,True,False,False,False,False,False,True
reverse sneeze or seizure,False,True,True,True,True,False,False,False,False,False,True
my dog is acting weird,False,True,True,True,True,False,False,False,False,True,True
dog constantly shows his belly and shakes,False,True,True,True,True,False,False,False,False,True,True
rejected by rescue because i use local dog park,False,True,True,True,True,False,False,False,False,False,True
i hate him with a passion,False,True,True,True,True,False,False,False,False,False,True
please help i am really scared,True,False,False,True,False,True,True,True,True,False,False
why does my dog suck,False,True,True,True,True,False,False,False,False,False,True
overexcited  year old puppy,False,True,True,True,True,False,False,False,False,False,True
need dog backyard inspiration with caveat,True,False,False,True,False,True,True,True,True,False,False
dog names,True,False,False,True,False,True,True,True,True,False,False
new puppy adult dog curious about their behavior,False,True,True,True,True,False,False,False,False,False,True
help need ideas re  year old pup,False,True,True,True,True,False,False,False,False,False,True
dog advice,False,True,True,True,True,False,False,False,False,False,True
spca refused to let me be with my  year old dog during euthanasia legal,False,True,True,True,True,False,False,False,False,False,True
dog pisses everywhere help,False,True,True,True,True,False,False,False,False,False,True
i hate him with a passion,False,True,True,True,True,False,False,False,False,False,True
what dog breeds,False,True,True,True,True,False,False,False,False,False,True
new puppy adult dog curious about their behavior,False,True,True,True,True,False,False,False,False,False,True
why does my dog suck,False,True,True,True,True,False,False,False,False,False,True
anxious dog,True,False,False,True,False,True,True,True,True,False,False
my dog wants to be you,False,True,True,True,True,False,False,False,False,False,True
welcoming a stray into our pack,False,True,True,True,True,False,False,False,False,False,True
why does my dog suck,False,True,True,True,True,False,False,False,False,False,True
overexcited  year old puppy,False,True,True,True,True,False,False,False,False,False,True
i buried my friend today,False,True,True,True,True,False,False,False,False,False,True
witness a small dog get rolled over by a car and got bit trying to help it,False,True,True,True,True,False,False,False,False,False,True
spca refused to let me be with my  year old dog during euthanasia legal,False,True,True,True,True,False,False,False,False,False,True
rejected by rescue because i use local dog park,False,True,True,True,True,False,False,False,False,False,True
dog pisses everywhere help,False,True,True,True,True,False,False,False,False,False,True
i hate him with a passion,False,True,True,True,True,False,False,False,False,False,True
why does my dog suck,False,True,True,True,True,False,False,False,False,False,True
new puppy adult dog curious about their behavior,False,True,True,True,True,False,False,False,False,False,True
i buried my friend today,False,True,True,True,True,False,False,False,False,False,True
dog pisses everywhere help,False,True,True,True,True,False,False,False,False,False,True
i hate him with a passion,False,True,True,True,True,False,False,False,False,False,True
new puppy adult dog curious about their behavior,False,True,True,True,True,False,False,False,False,False,True
ran into previous owner my heart is broken,False,True,True,True,True,False,False,False,False,False,True
my dog dislikes one of my housemates and snarls jumps on and is aggressive only to him,True,False,False,True,False,True,True,True,True,True,False
please pray for buddy  lately he has been vomiting with blood so we are trying to recover his health your prayers will help him recover so please help me see his happy jumping again he is my happiness,True,False,False,True,False,True,True,True,True,True,False
my boy is gone  suspected neurological condition,False,True,True,True,True,False,False,False,False,False,True
let me tell you how happy this makes me,False,True,True,True,True,False,False,False,False,False,True
happy birthday ziva you are an outstanding dog who does everything i ask of you you hunt test one day and field trial the next you look good in the show ring and even jump off of the dock but most importantly you are my best friend on those days im down,True,False,False,True,False,True,True,True,True,True,False
i miss you bubba,False,True,True,True,True,False,False,False,False,False,True
leo knows how to enjoy life  a walk through the tall grass and fresh air make him so happy that hes ready to run and jump forever,True,False,False,True,False,True,True,True,True,True,False
i hate going on trips,True,False,False,True,False,True,True,True,True,False,False
opinion on allowing your dog to misbehave,False,True,True,True,True,False,False,False,False,False,True
ma pooch i found him living in a metal barrel during a thunderstorm he had both eyes when i found him silver jumped through a barbed wire fence and injured his eye didnt think twice about the vet bill  years and still happy as could be,True,False,False,True,False,True,True,True,True,True,False
im scared of my dog,True,False,False,True,False,True,True,True,True,False,False
dogs are the best that is all,True,False,False,True,False,True,True,True,True,True,False
when he came to the sea for the first time in a year,True,False,False,True,False,True,True,True,True,True,False
goodbye ash,False,True,True,True,True,False,False,False,False,False,True
luna in the table,True,False,False,True,False,True,True,True,True,True,False
im crying inside is it my fault,False,True,True,True,True,False,False,False,False,False,True
i think its time,True,False,False,True,False,True,True,True,True,False,False
the dog after the grooming,True,False,False,True,False,True,True,True,True,True,False
norcal  sad story of a dog whos just looking for his best buddy but has been failed by humans and even rescues over and over again this is his third time at a shelter and hes been moved around for the last  years can you foster or responsibly adopt him,False,True,True,True,True,False,False,False,False,False,True
what breed do you guys think my sweet rescue is,False,True,True,True,True,False,False,False,False,False,True
makes my heart so happy i cannot express it,True,False,False,True,False,True,True,True,True,True,False
how is your summer going,True,False,False,True,False,True,True,True,True,True,False
benson wants to wish everyone a great day,False,True,True,True,True,False,False,False,False,False,True
canoe day,True,False,False,True,False,True,True,True,True,True,False
happy im home,True,False,False,True,False,True,True,True,True,False,False
bed stairs,True,False,False,True,False,True,True,True,True,False,False
temperament,False,True,True,True,True,False,False,False,False,True,True
its really happy,True,False,False,True,False,True,True,True,True,True,False
my dog needs help,False,True,True,True,True,False,False,False,False,False,True
joyful jumps the best welcome ever this is what oakley does every time he sees me,True,False,False,True,False,True,True,True,True,True,False
yesterday we lost two members of our family,True,False,False,True,False,True,True,True,True,False,False
happy,True,False,False,True,False,True,True,True,True,True,False
dog food question,False,True,True,True,True,False,False,False,False,False,True
my sweet girl is,True,False,False,True,False,True,True,True,True,True,False
happy pup,True,False,False,True,False,True,True,True,True,True,False
today my dog happy turns a year old,True,False,False,True,False,True,True,True,True,True,False
i initially didnt want dogs heres how i wound up with,False,True,True,True,True,False,False,False,False,False,True
i lost my dog last july  due to babesiosis,True,False,False,True,False,True,True,True,True,False,False
the happiest life,True,False,False,True,False,True,True,True,True,True,False
my gorgeous boy,True,False,False,True,False,True,True,True,True,True,False
before  after of foster puppy,True,False,False,True,False,True,True,True,True,False,False
theyre both sleepy hahaha,True,False,False,True,False,True,True,True,True,True,False
floating dog,True,False,False,True,False,True,True,True,True,True,False
oc when the grass is taller than the pups,True,False,False,True,False,True,True,True,True,True,False
oso,False,True,True,True,True,False,False,False,False,True,True
days post neuter is this ok,False,True,True,True,True,False,False,False,False,False,True
question for anyone who has worked at a doggy daycare,False,True,True,True,True,False,False,False,False,False,True
my dog tommy,True,False,False,True,False,True,True,True,True,False,False
this makes my day every time mini golden doodle cuteness,True,False,False,True,False,True,True,True,True,True,False
ran into previous owner my heart is broken,False,True,True,True,True,False,False,False,False,False,True
had to let go of my best bud yesterday,True,False,False,True,False,True,True,True,True,False,False
my boy is gone  suspected neurological condition,False,True,True,True,True,False,False,False,False,False,True
im crying inside is it my fault,False,True,True,True,True,False,False,False,False,False,True
i think its time,True,False,False,True,False,True,True,True,True,False,False
i miss my dog so much,False,True,True,True,True,False,False,False,False,False,True
dogs foot is swollen but wasnt this morning er now or vet in the morning,True,False,False,True,False,True,True,True,True,False,False
norcal  sad story of a dog whos just looking for his best buddy but has been failed by humans and even rescues over and over again this is his third time at a shelter and hes been moved around for the last  years can you foster or responsibly adopt him,False,True,True,True,True,False,False,False,False,False,True
gsd fyr suddenly not getting along with gsd f yr  yet grew up together,False,True,True,True,True,False,False,False,False,False,True
makes my heart so happy i cannot express it,True,False,False,True,False,True,True,True,True,True,False
celebrating the high times,True,False,False,True,False,True,True,True,True,False,False
im struggling with my reactive dog,False,True,True,True,True,False,False,False,False,True,True
my partners dog,False,True,True,True,True,False,False,False,False,False,True
feeling guiltysad,False,True,True,True,True,False,False,False,False,False,True
big trees down in portland,True,False,False,True,False,True,True,True,True,False,False
euthanasia,True,False,False,True,False,True,True,True,True,False,False
my girls  read description,False,True,True,True,True,False,False,False,False,False,True
i initially didnt want dogs heres how i wound up with,False,True,True,True,True,False,False,False,False,False,True
i lost my dog last july  due to babesiosis,True,False,False,True,False,True,True,True,True,False,False
can you give me some advice,True,False,False,True,False,True,True,True,True,False,False
is it normal for my dogs to fight when one of them has just moved in,True,False,False,True,False,True,True,True,True,False,False
dog fight,False,True,True,True,True,False,False,False,False,False,True
my dog was attacked a year ago he crosses the road when passing the house where it happens what can we do so he isnt so worried,True,False,False,True,False,True,True,True,True,False,False
yearold dog afraid of hardwood,False,True,True,True,True,False,False,False,False,False,True
my dog is scared of cheerble,False,True,True,True,True,False,False,False,False,False,True
any ideas what could be wrong,False,True,True,True,True,False,False,False,False,False,True
im concerned about a dog that isnt mine what do i do,False,True,True,True,True,False,False,False,False,False,True
my dog is sick any ideas,False,True,True,True,True,False,False,False,False,False,True
unfair situationwhat would you do if they was your dogs,False,True,True,True,True,False,False,False,False,False,True
a slight humble brag,False,True,True,True,True,False,False,False,False,False,True
my housemate is starving their dog what to do,False,True,True,True,True,False,False,False,False,False,True
we got a new dog which our old dog does not seem to accept,False,True,True,True,True,False,False,False,False,False,True
sad i had to take dog back to shelter,False,True,True,True,True,False,False,False,False,False,True
would another dog help my old girl,False,True,True,True,True,False,False,False,False,False,True
i just got a puppy,True,False,False,True,False,True,True,True,True,False,False
how to make your dog love you,False,True,True,True,True,False,False,False,False,False,True
goodbye thor you will always be the absolute goodest of boys,False,True,True,True,True,False,False,False,False,False,True
hippity hop does anyone elses dogs jump like this when excited,False,True,True,True,True,False,False,False,False,True,True
said goodbye to my best boy yesterday,False,True,True,True,True,False,False,False,False,False,True
dog treadmill,True,False,False,True,False,True,True,True,True,True,False
my boy is gone  suspected neurological condition,False,True,True,True,True,False,False,False,False,False,True
let me tell you how happy this makes me,False,True,True,True,True,False,False,False,False,False,True
goodbye mosi,False,True,True,True,True,False,False,False,False,False,True
doggo jumps with excitement after seeing himself on the news,True,False,False,True,False,True,True,True,True,True,False
how my  year old dog moose greets me when i come home gsdpyraneesanatolian mix,False,True,True,True,True,False,False,False,False,False,True
luna trying to self regulate her excitement by doing crazy jumps,True,False,False,True,False,True,True,True,True,True,False
fluffy is getting excited for his walk,True,False,False,True,False,True,True,True,True,True,False
english bulldog jumps on his new foam bed out of excitement see what happens next,True,False,False,True,False,True,True,True,True,True,False
my dog is aggressive towards me and keeps biting me how do i solve this,False,True,True,True,True,False,False,False,False,False,True
how to handle a mouthy dog,False,True,True,True,True,False,False,False,False,False,True
tomorrow my dog takes his final rest how am i supposed to sleep,False,True,True,True,True,False,False,False,False,False,True
dalmation nails,False,True,True,True,True,False,False,False,False,True,True
my dog was hit by a car yesterday,False,True,True,True,True,False,False,False,False,False,True
any suggestions,False,True,True,True,True,False,False,False,False,False,True
my partners dog,False,True,True,True,True,False,False,False,False,False,True
joyful jumps the best welcome ever this is what oakley does every time he sees me,True,False,False,True,False,True,True,True,True,True,False
my puppy doesnt get excited for me but does for others what am i doing wrong,False,True,True,True,True,False,False,False,False,False,True
how cute is this dog so excited about the baby,True,False,False,True,False,True,True,True,True,True,False
saidee,False,True,True,True,True,False,False,False,False,False,True
feeling guiltysad,False,True,True,True,True,False,False,False,False,False,True
need help,False,True,True,True,True,False,False,False,False,False,True
dog stretched eyelid,False,True,True,True,True,False,False,False,False,False,True
can someone help me figure out this dogs body language,False,True,True,True,True,False,False,False,False,False,True
is this normal or is my dog just psychotic,True,False,False,True,False,True,True,True,True,True,False
my dog is scared of cheerble,False,True,True,True,True,False,False,False,False,False,True
ocevery time he eats he is very excited,True,False,False,True,False,True,True,True,True,True,False
fluffy is getting excited for his walk,True,False,False,True,False,True,True,True,True,True,False
using a slip lead and a harness,False,True,True,True,True,False,False,False,False,False,True
dog thinks i abandoned her,False,True,True,True,True,False,False,False,False,True,True
jealous dog,False,True,True,True,True,False,False,False,False,True,True
training dogs for newborn,False,True,True,True,True,False,False,False,False,False,True
should i be concerned or worried,False,True,True,True,True,False,False,False,False,False,True
my dog locked my housemate out of the house so she could watch adventure time alone,False,True,True,True,True,False,False,False,False,False,True
st time dog owner,False,True,True,True,True,False,False,False,False,True,True
unfair situationwhat would you do if they was your dogs,False,True,True,True,True,False,False,False,False,False,True
a slight humble brag,False,True,True,True,True,False,False,False,False,False,True
i accidentally hurt my dog and feel horrible,False,True,True,True,True,False,False,False,False,False,True
our female dog suddenly changed behavior and now aggressively licks and nibbles me my brothers and mom everywhere,False,True,True,True,True,False,False,False,False,True,True
training tips for your new dog,False,True,True,True,True,False,False,False,False,False,True
my puppy whos really lively a few hours ago now sleeps alot after he injured his leg,False,True,True,True,True,False,False,False,False,False,True
vent shady rescue  an adoption story,False,True,True,True,True,False,False,False,False,False,True
brain training for dogs,False,True,True,True,True,False,False,False,False,False,True
ways to train calmness in your dog,False,True,True,True,True,False,False,False,False,False,True
some advice needed,False,True,True,True,True,False,False,False,False,False,True
pet store animal cruelty,False,True,True,True,True,False,False,False,False,False,True
did my dog reincarnate,False,True,True,True,True,False,False,False,False,False,True
said goodbye to my best boy yesterday,False,True,True,True,True,False,False,False,False,False,True
goodbye mosi,False,True,True,True,True,False,False,False,False,False,True
jump scare,True,False,False,True,False,True,True,True,True,False,False
my  year old golden retriever died suddenly my arms in just  minutes,False,True,True,True,True,False,False,False,False,False,True
i screamed at a jump scare in the game my husband was playing and my girls came to my rescue havent left my lap since,True,False,False,True,False,True,True,True,True,True,False
my girl finally made it without getting scared she even did her first jump into the water,True,False,False,True,False,True,True,True,True,True,False
im scared of my dog,True,False,False,True,False,True,True,True,True,False,False
help needed is there still hope for nova and if so do you know anyone who could help her shes at downey acc ca and is past deadline new deadline monday  are you experienced with scared  behavioral dogs and can foster  train  help her,False,True,True,True,True,False,False,False,False,False,True
i dont know what is causing my malinois mix to be in pain,False,True,True,True,True,False,False,False,False,False,True
tomorrow my dog takes his final rest how am i supposed to sleep,False,True,True,True,True,False,False,False,False,False,True
bed stairs,True,False,False,True,False,True,True,True,True,False,False
any suggestions,False,True,True,True,True,False,False,False,False,False,True
my dog is puring,True,False,False,True,False,True,True,True,True,False,False
just need to share our little win,True,False,False,True,False,True,True,True,True,False,False
to clarify on my last post,False,True,True,True,True,False,False,False,False,False,True
pain or anxiety,False,True,True,True,True,False,False,False,False,False,True
can someone help me figure out this dogs body language,False,True,True,True,True,False,False,False,False,False,True
my girls  read description,False,True,True,True,True,False,False,False,False,False,True
new puppy hurting my other dog,False,True,True,True,True,False,False,False,False,False,True
im scared my dog is becoming distantbonding with someone else over me,False,True,True,True,True,False,False,False,False,False,True
i lost my dog last july  due to babesiosis,True,False,False,True,False,True,True,True,True,False,False
horrifying puppy class experience im not sure how to feel about this i just need to share it,False,True,True,True,True,False,False,False,False,False,True
dog fight,False,True,True,True,True,False,False,False,False,False,True
her name should have been houdini,True,False,False,True,False,True,True,True,True,False,False
a local dog started loving me but i am scared,True,False,False,True,False,True,True,True,True,False,False
jealous dogs,False,True,True,True,True,False,False,False,False,False,True
yearold dog afraid of hardwood,False,True,True,True,True,False,False,False,False,False,True
my dog is scared of cheerble,False,True,True,True,True,False,False,False,False,False,True
dog is still skittish around the cats,False,True,True,True,True,False,False,False,False,True,True
i need advice,False,True,True,True,True,False,False,False,False,False,True
using a slip lead and a harness,False,True,True,True,True,False,False,False,False,False,True
my dog is distracted by his leash and it is scaring me please help,False,True,True,True,True,False,False,False,False,True,True
my dog is suddenly afraid of my other dogs cough,False,True,True,True,True,False,False,False,False,False,True
please any advice you can give ill appreciate,False,True,True,True,True,False,False,False,False,False,True
should i be concerned or worried,False,True,True,True,True,False,False,False,False,False,True
story time my gsd saved me from possible kidnapping,True,False,False,True,False,True,True,True,True,False,False
