title,angry,anxious,bark,behavior_category_2,behavior_category_3,behavior_category_5,growl,lick,whine,relevance,scared
dog growls despite being happy and wanting to be pet,True,False,False,True,False,True,True,True,True,False,False
this is shady it has been a year now since i lost my big guy he was such a good boy also my protector,True,False,False,True,False,True,True,True,True,False,False
my sweet angel,False,True,True,True,True,False,False,False,False,False,True
please share  dakotas needs a new foster or a loving forever home asap her owner surrendered her to a shelter  signed her euth papers because he had no more time for her and now her foster also cant keep her shes been through so much  really needs a stable fosterhome can you help her,False,True,True,True,True,False,False,False,False,False,True
is my dog suffering are we doing right by euthanizing him tomorrow,False,True,True,True,True,False,False,False,False,False,True
please share  dakotas needs a new foster or a loving forever home asap her owner surrendered her to a shelter because he suddenly had no more time for her and now her foster can also not keep her shes been through so much and really needs a stable fosterhome can you help her,False,True,True,True,True,False,False,False,False,False,True
dog sitting  puppy is biting and barking constantly  in need of help  advice,False,True,True,True,True,False,False,False,False,False,True
haha my dog doesnt like you,False,True,True,True,True,False,False,False,False,False,True
just wanted to share a happy story,True,False,False,True,False,True,True,True,True,False,False
our dog is suddenly agressive towards other dogs in the household how can we solve this is the environment is it serious he was never like this before,False,True,True,True,True,False,False,False,False,False,True
help,True,False,False,True,False,True,True,True,True,False,False
how to gain your dogs trust back,False,True,True,True,True,False,False,False,False,False,True
my dog and his frog toy,True,False,False,True,False,True,True,True,True,False,False
why is my hound so happy hunting prey,True,False,False,True,False,True,True,True,True,False,False
sneaking in my lb toothless purse poodle,True,False,False,True,False,True,True,True,True,False,False
help why is my dog growling,False,True,True,True,True,False,False,False,False,False,True
dog growling at night,True,False,False,True,False,True,True,True,True,True,False
how do i calm my anxious shepherd mix dog,False,True,True,True,True,False,False,False,False,False,True
having actual scary dog priviledge is actually great for anxiety,False,True,True,True,True,False,False,False,False,False,True
we got a new dog which our old dog does not seem to accept,False,True,True,True,True,False,False,False,False,False,True
i think i made a big mistake,False,True,True,True,True,False,False,False,False,False,True
help giving adopted nervous dog the best shot at adjusting,False,True,True,True,True,False,False,False,False,False,True
tips on new foster japanese spitz german shepherd mix,False,True,True,True,True,False,False,False,False,False,True
i need to return my shelter dog,False,True,True,True,True,False,False,False,False,False,True
help nipping and growling  how to stop,False,True,True,True,True,False,False,False,False,True,True
emotionally exhausted with dog,False,True,True,True,True,False,False,False,False,False,True
vet gave a terminal diagnosis for my boy of  years dont know how to process this devastation,False,True,True,True,True,False,False,False,False,False,True
my sweet angel,False,True,True,True,True,False,False,False,False,False,True
gsd fyr suddenly not getting along with gsd f yr  yet grew up together,False,True,True,True,True,False,False,False,False,False,True
my girls  read description,False,True,True,True,True,False,False,False,False,False,True
our pup has a broken leg,False,True,True,True,True,False,False,False,False,False,True
is it normal for my dogs to fight when one of them has just moved in,True,False,False,True,False,True,True,True,True,False,False
our dog is suddenly agressive towards other dogs in the household how can we solve this is the environment is it serious he was never like this before,False,True,True,True,True,False,False,False,False,False,True
how to gain your dogs trust back,False,True,True,True,True,False,False,False,False,False,True
how do i calm my anxious shepherd mix dog,False,True,True,True,True,False,False,False,False,False,True
we got a new dog which our old dog does not seem to accept,False,True,True,True,True,False,False,False,False,False,True
sad i had to take dog back to shelter,False,True,True,True,True,False,False,False,False,False,True
heart broken,False,True,True,True,True,False,False,False,False,False,True
can second owners be enough,False,True,True,True,True,False,False,False,False,False,True
i need to return my shelter dog,False,True,True,True,True,False,False,False,False,False,True
houston shelter is euthanizing  dogs today,True,False,False,True,False,True,True,True,True,False,False
vet gave a terminal diagnosis for my boy of  years dont know how to process this devastation,False,True,True,True,True,False,False,False,False,False,True
my dog attacked another dog,False,True,True,True,True,False,False,False,False,False,True
weird behavior from other dogs,False,True,True,True,True,False,False,False,False,False,True
can anyone help me figure out what breed my handsome boy might be,False,True,True,True,True,False,False,False,False,False,True
haha my dog doesnt like you,False,True,True,True,True,False,False,False,False,False,True
my dog grows at me,False,True,True,True,True,False,False,False,False,True,True
new dog drama,False,True,True,True,True,False,False,False,False,False,True
former reactive dog vent,False,True,True,True,True,False,False,False,False,False,True
advice for a novice dog sister sorry this is very long but i just want the best for my new brother your time and advice is appreciated thank you,False,True,True,True,True,False,False,False,False,False,True
puppy doesnt like half the family any advice,False,True,True,True,True,False,False,False,False,False,True
can second owners be enough,False,True,True,True,True,False,False,False,False,False,True
emotionally exhausted with dog,False,True,True,True,True,False,False,False,False,False,True
dakotas owner surrendered her and signed her euth papers he suddenly had no time for her any more now she is past deadline and her life could end any moment at downey acc in ca her final notice expired oct  dakota is in high danger of being euth any time because she is timid and scared,False,True,True,True,True,False,False,False,False,False,True
im scared of my dog,True,False,False,True,False,True,True,True,True,False,False
rambos owner had to surrender him because he became ill and the ppl who claimed to be interested all flaked he is scared and hasnt had the easiest life hes at downey acc in ca way past deadline new deadline  am he needs a breedexperienced foster or responsible adopter immediately,False,True,True,True,True,False,False,False,False,False,True
help needed is there still hope for nova and if so do you know anyone who could help her shes at downey acc ca and is past deadline new deadline monday  are you experienced with scared  behavioral dogs and can foster  train  help her,False,True,True,True,True,False,False,False,False,False,True
my dog attacked another dog,False,True,True,True,True,False,False,False,False,False,True
please share  dakotas needs a new foster or a loving forever home asap her owner surrendered her to a shelter  signed her euth papers because he had no more time for her and now her foster also cant keep her shes been through so much  really needs a stable fosterhome can you help her,False,True,True,True,True,False,False,False,False,False,True
scared rooney is out of public view so he has no chance of getting seen today will be his last day his final notice expired oct  foster and rescue urgently needed to save rooneys life can you help rooney by fostering or responsibly adopting him,False,True,True,True,True,False,False,False,False,False,True
please share  dakotas needs a new foster or a loving forever home asap her owner surrendered her to a shelter because he suddenly had no more time for her and now her foster can also not keep her shes been through so much and really needs a stable fosterhome can you help her,False,True,True,True,True,False,False,False,False,False,True
weird behaviour,True,False,False,True,False,True,True,True,True,False,False
advice needed for my two chihuahuas thank you in advance,False,True,True,True,True,False,False,False,False,False,True
my dog is puring,True,False,False,True,False,True,True,True,True,False,False
dog anxiety around men,False,True,True,True,True,False,False,False,False,False,True
help my dog hates my brother,False,True,True,True,True,False,False,False,False,False,True
just wanted to share a happy story,True,False,False,True,False,True,True,True,True,False,False
dog is growling at me,True,False,False,True,False,True,True,True,True,False,False
my girls  read description,False,True,True,True,True,False,False,False,False,False,True
new puppy hurting my other dog,False,True,True,True,True,False,False,False,False,False,True
dog suddenly aggressive,False,True,True,True,True,False,False,False,False,False,True
should we adopt our first dog,False,True,True,True,True,False,False,False,False,False,True
my dog barks and growls when i bleed,True,False,False,True,False,True,True,True,True,False,False
aggressive dog walking advice,False,True,True,True,True,False,False,False,False,False,True
paranormal pet cam,False,True,True,True,True,False,False,False,False,False,True
dogs cant get along,True,False,False,True,False,True,True,True,True,True,False
former reactive dog vent,False,True,True,True,True,False,False,False,False,False,True
is dog to dog aggression normal for border collies if so how do i fix this,False,True,True,True,True,False,False,False,False,False,True
dog training,False,True,True,True,True,False,False,False,False,False,True
dog aggression need help,False,True,True,True,True,False,False,False,False,False,True
protect my cats,False,True,True,True,True,False,False,False,False,False,True
how do i stop my dog from growling,True,False,False,True,False,True,True,True,True,False,False
rehoming our dog,False,True,True,True,True,False,False,False,False,False,True
advice my dog is suddenly aggressive what do i do,False,True,True,True,True,False,False,False,False,False,True
how do i calm my anxious shepherd mix dog,False,True,True,True,True,False,False,False,False,False,True
should we rehome a  month old gsd who never displayed aggression but bit my wife help,False,True,True,True,True,False,False,False,False,False,True
introducing aggressive dogs,False,True,True,True,True,False,False,False,False,False,True
advice for a novice dog sister sorry this is very long but i just want the best for my new brother your time and advice is appreciated thank you,False,True,True,True,True,False,False,False,False,False,True
i feel guilty for kicking an off leash dog,True,False,False,True,False,True,True,True,True,False,False
need advice my dog got bit and acting funny,False,True,True,True,True,False,False,False,False,False,True
puppy is behaving abnormal,False,True,True,True,True,False,False,False,False,False,True
help giving adopted nervous dog the best shot at adjusting,False,True,True,True,True,False,False,False,False,False,True
need some help,False,True,True,True,True,False,False,False,False,False,True
help older established dog is afraid of small pup,False,True,True,True,True,False,False,False,False,False,True
my dog is staring at me,False,True,True,True,True,False,False,False,False,False,True
mothers dog is aggressive and bites me need help getting him removed from house without her knowing i called animal control,True,False,False,True,False,True,True,True,True,False,False
new puppy adult dog curious about their behavior,False,True,True,True,True,False,False,False,False,False,True
help nipping and growling  how to stop,False,True,True,True,True,False,False,False,False,True,True
big angry rottweiler dog wont let me leave the house  very funny dog growling  cute or scary,True,False,False,True,False,True,True,True,True,True,False
is it weird my dogs never growled at me or been angry before with me,True,False,False,True,False,True,True,True,True,False,False
new dog drama,False,True,True,True,True,False,False,False,False,False,True
dog training,False,True,True,True,True,False,False,False,False,False,True
help why is my dog growling,False,True,True,True,True,False,False,False,False,False,True
introducing new cats,False,True,True,True,True,False,False,False,False,False,True
gsd fyr suddenly not getting along with gsd f yr  yet grew up together,False,True,True,True,True,False,False,False,False,False,True
dog sitting  puppy is biting and barking constantly  in need of help  advice,False,True,True,True,True,False,False,False,False,False,True
dog anxiety around men,False,True,True,True,True,False,False,False,False,False,True
strange women tickles my dog,False,True,True,True,True,False,False,False,False,False,True
please help dog on crate rest,False,True,True,True,True,False,False,False,False,True,True
dogs been having a few outbursts as a late,False,True,True,True,True,False,False,False,False,False,True
former reactive dog vent,False,True,True,True,True,False,False,False,False,False,True
tips on new foster japanese spitz german shepherd mix,False,True,True,True,True,False,False,False,False,False,True
anyone else have a dog who loves their cat but the cat absolutely hates the dog,True,False,False,True,False,True,True,True,True,False,False
houston shelter is euthanizing  dogs today,True,False,False,True,False,True,True,True,True,False,False
is the humane society better than adopting and rehoming please remove if not allowed,False,True,True,True,True,False,False,False,False,False,True
i cry every time i look at my dog,False,True,True,True,True,False,False,False,False,False,True
healthy and happy play,True,False,False,True,False,True,True,True,True,True,False
got a new dog  can anyone tell me if this is aggressive behavior towards my cat he is my first dog,True,False,False,True,False,True,True,True,True,True,False
he protec he attac  week old gsd mix with his first non play bark and growl,True,False,False,True,False,True,True,True,True,True,False
is this behavior normal play or something more,False,True,True,True,True,False,False,False,False,False,True
rambos owner had to surrender him because he became ill and the ppl who claimed to be interested all flaked he is scared and hasnt had the easiest life hes at downey acc in ca way past deadline new deadline  am he needs a breedexperienced foster or responsible adopter immediately,False,True,True,True,True,False,False,False,False,False,True
this is shady it has been a year now since i lost my big guy he was such a good boy also my protector,True,False,False,True,False,True,True,True,True,False,False
my sweet angel,False,True,True,True,True,False,False,False,False,False,True
my dog attacked another dog,False,True,True,True,True,False,False,False,False,False,True
gsd fyr suddenly not getting along with gsd f yr  yet grew up together,False,True,True,True,True,False,False,False,False,False,True
weird behavior from other dogs,False,True,True,True,True,False,False,False,False,False,True
is my dog suffering are we doing right by euthanizing him tomorrow,False,True,True,True,True,False,False,False,False,False,True
aggressive puppy,True,False,False,True,False,True,True,True,True,False,False
ideas for new dog meet  greet,True,False,False,True,False,True,True,True,True,False,False
dog sitting  puppy is biting and barking constantly  in need of help  advice,False,True,True,True,True,False,False,False,False,False,True
anyone know the breed,True,False,False,True,False,True,True,True,True,False,False
does my dog enjoy this game,True,False,False,True,False,True,True,True,True,False,False
since you all adored yo dorly i thought i would share some stories of her,False,True,True,True,True,False,False,False,False,False,True
dogo argentino puppy its from an aunt used to play with me as a puppy but doesnt seem to recognize me now months later,True,False,False,True,False,True,True,True,True,True,False
stop dogs getting in,False,True,True,True,True,False,False,False,False,False,True
my dog grows at me,False,True,True,True,True,False,False,False,False,True,True
growlingbehavior,True,False,False,True,False,True,True,True,True,False,False
new puppy hurting my other dog,False,True,True,True,True,False,False,False,False,False,True
dog toy possession help,True,False,False,True,False,True,True,True,True,False,False
strange women tickles my dog,False,True,True,True,True,False,False,False,False,False,True
is this their version of play or are they fighting i assume its only playing but id like to be sure,True,False,False,True,False,True,True,True,True,True,False
biting puppy but only bites me how do i get him to stop,False,True,True,True,True,False,False,False,False,False,True
dog pacing protecting toy,True,False,False,True,False,True,True,True,True,True,False
play or fight,True,False,False,True,False,True,True,True,True,False,False
is it normal for my dogs to fight when one of them has just moved in,True,False,False,True,False,True,True,True,True,False,False
puppy not napping own his own,False,True,True,True,True,False,False,False,False,False,True
how to gain your dogs trust back,False,True,True,True,True,False,False,False,False,False,True
i feel so guilty giving my dog prozac,False,True,True,True,True,False,False,False,False,True,True
am i the only one,False,True,True,True,True,False,False,False,False,False,True
dog behaviour help,False,True,True,True,True,False,False,False,False,True,True
dogs cant get along,True,False,False,True,False,True,True,True,True,True,False
former reactive dog vent,False,True,True,True,True,False,False,False,False,False,True
did i do wrong,False,True,True,True,True,False,False,False,False,False,True
my dog is acting weird,False,True,True,True,True,False,False,False,False,True,True
golden doodlecat situation,False,True,True,True,True,False,False,False,False,False,True
help  growling dog,True,False,False,True,False,True,True,True,True,False,False
is dog to dog aggression normal for border collies if so how do i fix this,False,True,True,True,True,False,False,False,False,False,True
i need tips on dogs behaviour,True,False,False,True,False,True,True,True,True,False,False
how do i stop my dog from growling,True,False,False,True,False,True,True,True,True,False,False
rehoming our dog,False,True,True,True,True,False,False,False,False,False,True
help needed asap,True,False,False,True,False,True,True,True,True,False,False
barking at night at nothing,False,True,True,True,True,False,False,False,False,False,True
adopted dog with biting issues,False,True,True,True,True,False,False,False,False,False,True
anyone know the breed,True,False,False,True,False,True,True,True,True,False,False
new puppy adult dog curious about their behavior,False,True,True,True,True,False,False,False,False,False,True
gsd fyr suddenly not getting along with gsd f yr  yet grew up together,False,True,True,True,True,False,False,False,False,False,True
my dog is puring,True,False,False,True,False,True,True,True,True,False,False
strange women tickles my dog,False,True,True,True,True,False,False,False,False,False,True
need advice my dog got bit and acting funny,False,True,True,True,True,False,False,False,False,False,True
i need help,True,False,False,True,False,True,True,True,True,False,False
change in behavior help,False,True,True,True,True,False,False,False,False,False,True
i need to return my shelter dog,False,True,True,True,True,False,False,False,False,False,True
yr old dog attacking  yr old dog used to be best buds,True,False,False,True,False,True,True,True,True,False,False
need suggestions,False,True,True,True,True,False,False,False,False,True,True
should i put down my dog,False,True,True,True,True,False,False,False,False,False,True
new puppy adult dog curious about their behavior,False,True,True,True,True,False,False,False,False,False,True
vet gave a terminal diagnosis for my boy of  years dont know how to process this devastation,False,True,True,True,True,False,False,False,False,False,True
stop dogs getting in,False,True,True,True,True,False,False,False,False,False,True
strange women tickles my dog,False,True,True,True,True,False,False,False,False,False,True
i feel so guilty giving my dog prozac,False,True,True,True,True,False,False,False,False,True,True
i feel guilty for kicking an off leash dog,True,False,False,True,False,True,True,True,True,False,False
i need to return my shelter dog,False,True,True,True,True,False,False,False,False,False,True
i need tips on dogs behaviour,True,False,False,True,False,True,True,True,True,False,False
rambos owner had to surrender him because he became ill and the ppl who claimed to be interested all flaked he is scared and hasnt had the easiest life hes at downey acc in ca way past deadline new deadline  am he needs a breedexperienced foster or responsible adopter immediately,False,True,True,True,True,False,False,False,False,False,True
help needed is there still hope for nova and if so do you know anyone who could help her shes at downey acc ca and is past deadline new deadline monday  are you experienced with scared  behavioral dogs and can foster  train  help her,False,True,True,True,True,False,False,False,False,False,True
my girls keep fighting,False,True,True,True,True,False,False,False,False,False,True
my dog attacked another dog,False,True,True,True,True,False,False,False,False,False,True
scared rooney is out of public view so he has no chance of getting seen today will be his last day his final notice expired oct  foster and rescue urgently needed to save rooneys life can you help rooney by fostering or responsibly adopting him,False,True,True,True,True,False,False,False,False,False,True
can anyone help me figure out what breed my handsome boy might be,False,True,True,True,True,False,False,False,False,False,True
what would cause a dog to growl at me,True,False,False,True,False,True,True,True,True,False,False
dog vs friend,False,True,True,True,True,False,False,False,False,False,True
biting puppy but only bites me how do i get him to stop,False,True,True,True,True,False,False,False,False,False,True
please help dog on crate rest,False,True,True,True,True,False,False,False,False,True,True
puppy not napping own his own,False,True,True,True,True,False,False,False,False,False,True
need suggestions,False,True,True,True,True,False,False,False,False,True,True
dogs been having a few outbursts as a late,False,True,True,True,True,False,False,False,False,False,True
do dogs bark when they run after you,False,True,True,True,True,False,False,False,False,False,True
former reactive dog vent,False,True,True,True,True,False,False,False,False,False,True
should i put down my dog,False,True,True,True,True,False,False,False,False,False,True
did i do wrong,False,True,True,True,True,False,False,False,False,False,True
is dog to dog aggression normal for border collies if so how do i fix this,False,True,True,True,True,False,False,False,False,False,True
my dog attacks my other  dogs for no reason,False,True,True,True,True,False,False,False,False,False,True
aggressive dog advice,True,False,False,True,False,True,True,True,True,False,False
random puppy aggression help,False,True,True,True,True,False,False,False,False,False,True
how do i calm my anxious shepherd mix dog,False,True,True,True,True,False,False,False,False,False,True
having actual scary dog priviledge is actually great for anxiety,False,True,True,True,True,False,False,False,False,False,True
we got a new dog which our old dog does not seem to accept,False,True,True,True,True,False,False,False,False,False,True
i think i made a big mistake,False,True,True,True,True,False,False,False,False,False,True
advice for a novice dog sister sorry this is very long but i just want the best for my new brother your time and advice is appreciated thank you,False,True,True,True,True,False,False,False,False,False,True
female dog getting aggressive help,True,False,False,True,False,True,True,True,True,False,False
dakotas owner surrendered her and signed her euth papers he suddenly had no time for her any more now she is past deadline and her life could end any moment at downey acc in ca her final notice expired oct  dakota is in high danger of being euth any time because she is timid and scared,False,True,True,True,True,False,False,False,False,False,True
help needed is there still hope for nova and if so do you know anyone who could help her shes at downey acc ca and is past deadline new deadline monday  are you experienced with scared  behavioral dogs and can foster  train  help her,False,True,True,True,True,False,False,False,False,False,True
please share  dakotas needs a new foster or a loving forever home asap her owner surrendered her to a shelter  signed her euth papers because he had no more time for her and now her foster also cant keep her shes been through so much  really needs a stable fosterhome can you help her,False,True,True,True,True,False,False,False,False,False,True
please share  dakotas needs a new foster or a loving forever home asap her owner surrendered her to a shelter because he suddenly had no more time for her and now her foster can also not keep her shes been through so much and really needs a stable fosterhome can you help her,False,True,True,True,True,False,False,False,False,False,True
