title,angry,anxious,bark,behavior_category_2,behavior_category_3,behavior_category_5,growl,lick,whine,relevance,scared
help choosing a dog breed,False,True,True,True,True,False,False,False,False,False,True
please help dog on crate rest,False,True,True,True,True,False,False,False,False,True,True
my dog is miserable,False,True,True,True,True,False,False,False,False,False,True
demand barking at other dogs,False,True,True,True,True,False,False,False,False,True,True
help dog whines every evening and we have no idea why,False,True,True,True,True,False,False,False,False,False,True
separation anxiety in dogs,False,True,True,True,True,False,False,False,False,False,True
whats your happysad dog story,False,True,True,True,True,False,False,False,False,False,True
got a new dog  can anyone tell me if this is aggressive behavior towards my cat he is my first dog,True,False,False,True,False,True,True,True,True,True,False
i dont know what is causing my malinois mix to be in pain,False,True,True,True,True,False,False,False,False,False,True
newly adopted short dane mix  zenji,False,True,True,True,True,False,False,False,False,False,True
storm anxiety,False,True,True,True,True,False,False,False,False,False,True
bonded dogsseparate homes,True,False,False,True,False,True,True,True,True,False,False
my puppy doesnt get excited for me but does for others what am i doing wrong,False,True,True,True,True,False,False,False,False,False,True
dog scoring criteria,False,True,True,True,True,False,False,False,False,False,True
dog wont stop wanting to go out,False,True,True,True,True,False,False,False,False,False,True
is it too late to train a dog to be alone at  weeks of age,False,True,True,True,True,False,False,False,False,False,True
babysitting dog who cries all day,False,True,True,True,True,False,False,False,False,False,True
sick jack russell  any similar experiences,False,True,True,True,True,False,False,False,False,False,True
advice on adopting a stray,True,False,False,True,False,True,True,True,True,False,False
huge bump on dog head pls help,False,True,True,True,True,False,False,False,False,False,True
horrifying puppy class experience im not sure how to feel about this i just need to share it,False,True,True,True,True,False,False,False,False,False,True
dogsitting two dogs that arent a good match,False,True,True,True,True,False,False,False,False,False,True
my year old dog is freaking out over thunder,False,True,True,True,True,False,False,False,False,False,True
i feel so guilty giving my dog prozac,False,True,True,True,True,False,False,False,False,True,True
need help getting puppy to stop rough playing and biting my other dog,True,False,False,True,False,True,True,True,True,False,False
is my dog possibly going through depression,False,True,True,True,True,False,False,False,False,False,True
adopted dog not listening help,False,True,True,True,True,False,False,False,False,False,True
dogs meeting kitten question,False,True,True,True,True,False,False,False,False,False,True
nighttime whines,True,False,False,True,False,True,True,True,True,False,False
golden doodlecat situation,False,True,True,True,True,False,False,False,False,False,True
help i dont know what is wrong with my dog,False,True,True,True,True,False,False,False,False,False,True
a hard decision,False,True,True,True,True,False,False,False,False,False,True
i need tips on dogs behaviour,True,False,False,True,False,True,True,True,True,False,False
month old dog rebelling,False,True,True,True,True,False,False,False,False,False,True
barking at night at nothing,False,True,True,True,True,False,False,False,False,False,True
why does my dog picks all her toys and then cries,True,False,False,True,False,True,True,True,True,False,False
im so tired my eye has been twitching for  hours,False,True,True,True,True,False,False,False,False,False,True
demand barking at other dogs,False,True,True,True,True,False,False,False,False,True,True
my dog keeps barking at me,False,True,True,True,True,False,False,False,False,False,True
need help with chihuahua,False,True,True,True,True,False,False,False,False,False,True
foster dog tips,False,True,True,True,True,False,False,False,False,False,True
brain training for dogs,False,True,True,True,True,False,False,False,False,False,True
my dog is suddenly very attached and whiny with my adult son,True,False,False,True,False,True,True,True,True,False,False
i hate him with a passion,False,True,True,True,True,False,False,False,False,False,True
help border collie refuses to go outside,False,True,True,True,True,False,False,False,False,False,True
what does your typical schedule look like help please,False,True,True,True,True,False,False,False,False,False,True
help my roommate doesnt take care of her dog,False,True,True,True,True,False,False,False,False,False,True
help dog whines every evening and we have no idea why,False,True,True,True,True,False,False,False,False,False,True
puppy help  whining and negative behaviors,True,False,False,True,False,True,True,True,True,False,False
what is this sound that my roommates dog makes,True,False,False,True,False,True,True,True,True,True,False
curious because i see a bow marking what do you see,True,False,False,True,False,True,True,True,True,True,False
why does my hunting x cattle dog guard baby animals,False,True,True,True,True,False,False,False,False,False,True
why does my hunting x cattle dog guard baby animals,False,True,True,True,True,False,False,False,False,False,True
my puppy doesnt get excited for me but does for others what am i doing wrong,False,True,True,True,True,False,False,False,False,False,True
i dont know what to do my dogs health is declining fast,False,True,True,True,True,False,False,False,False,False,True
horrifying puppy class experience im not sure how to feel about this i just need to share it,False,True,True,True,True,False,False,False,False,False,True
depressed dog,False,True,True,True,True,False,False,False,False,False,True
does my dog need trainer,True,False,False,True,False,True,True,True,True,False,False
my dog whinesseems like he is in pain when he itches his ear why,True,False,False,True,False,True,True,True,True,False,False
how do you care for a deaf and blind dog,False,True,True,True,True,False,False,False,False,False,True
i hate him with a passion,False,True,True,True,True,False,False,False,False,False,True
jealous dog,False,True,True,True,True,False,False,False,False,True,True
i feel so guilty giving my dog prozac,False,True,True,True,True,False,False,False,False,True,True
more dog than i can handle,True,False,False,True,False,True,True,True,True,False,False
lonely dog we think,False,True,True,True,True,False,False,False,False,False,True
depressed dog,False,True,True,True,True,False,False,False,False,False,True
i need tips on dogs behaviour,True,False,False,True,False,True,True,True,True,False,False
more dog than i can handle,True,False,False,True,False,True,True,True,True,False,False
while filming the landscape my dachshund became impatient and started to whine he then became bored and decided to eat the moist grass with freshly melted frost,True,False,False,True,False,True,True,True,True,True,False
our pup saved our lives,True,False,False,True,False,True,True,True,True,False,False
newly adopted short dane mix  zenji,False,True,True,True,True,False,False,False,False,False,True
weenie acting scared randomly,False,True,True,True,True,False,False,False,False,False,True
dog is acting strange,False,True,True,True,True,False,False,False,False,False,True
storm anxiety,False,True,True,True,True,False,False,False,False,False,True
babysitting dog who cries all day,False,True,True,True,True,False,False,False,False,False,True
extremely anxious pup,False,True,True,True,True,False,False,False,False,True,True
barking at night at nothing,False,True,True,True,True,False,False,False,False,False,True
my youngest dog has separation anxiety from the older oneany suggestions to stop this,False,True,True,True,True,False,False,False,False,True,True
older dog crying through the night family is at their wits end,False,True,True,True,True,False,False,False,False,False,True
brain training for dogs,False,True,True,True,True,False,False,False,False,False,True
separation anxiety in dogs,False,True,True,True,True,False,False,False,False,False,True
rip georgie girl,False,True,True,True,True,False,False,False,False,False,True
senior dog with really bad habits is it possible to fix,False,True,True,True,True,False,False,False,False,False,True
my puppy doesnt get excited for me but does for others what am i doing wrong,False,True,True,True,True,False,False,False,False,False,True
dog scoring criteria,False,True,True,True,True,False,False,False,False,False,True
dog shakes blanket off crate,True,False,False,True,False,True,True,True,True,True,False
to clarify on my last post,False,True,True,True,True,False,False,False,False,False,True
is it too late to train a dog to be alone at  weeks of age,False,True,True,True,True,False,False,False,False,False,True
babysitting dog who cries all day,False,True,True,True,True,False,False,False,False,False,True
my sad dog,False,True,True,True,True,False,False,False,False,True,True
horrifying puppy class experience im not sure how to feel about this i just need to share it,False,True,True,True,True,False,False,False,False,False,True
please help dog on crate rest,False,True,True,True,True,False,False,False,False,True,True
is this a senior citizen thing or something i should be concerned about whining for no reason,True,False,False,True,False,True,True,True,True,True,False
adopted dog not listening help,False,True,True,True,True,False,False,False,False,False,True
i need advice,False,True,True,True,True,False,False,False,False,False,True
nighttime whines,True,False,False,True,False,True,True,True,True,False,False
runaway dog  advice and vent,False,True,True,True,True,False,False,False,False,False,True
when one spouse wont crate train,True,False,False,True,False,True,True,True,True,False,False
im so tired my eye has been twitching for  hours,False,True,True,True,True,False,False,False,False,False,True
older dog crying through the night family is at their wits end,False,True,True,True,True,False,False,False,False,False,True
my dog keeps barking at me,False,True,True,True,True,False,False,False,False,False,True
separation anxiety in dogs,False,True,True,True,True,False,False,False,False,False,True
puppy help  whining and negative behaviors,True,False,False,True,False,True,True,True,True,False,False
rip georgie girl,False,True,True,True,True,False,False,False,False,False,True
why would a barking dog walk away with a whine,True,False,False,True,False,True,True,True,True,False,False
dog peeing,False,True,True,True,True,False,False,False,False,False,True
dog wont stop wanting to go out,False,True,True,True,True,False,False,False,False,False,True
to clarify on my last post,False,True,True,True,True,False,False,False,False,False,True
babysitting dog who cries all day,False,True,True,True,True,False,False,False,False,False,True
horrifying puppy class experience im not sure how to feel about this i just need to share it,False,True,True,True,True,False,False,False,False,False,True
year old maltichon whines for everything help,False,True,True,True,True,False,False,False,False,False,True
should i stop letting my dog beg,False,True,True,True,True,False,False,False,False,False,True
help in understanding what is happening with my dog,True,False,False,True,False,True,True,True,True,False,False
separation anxiety help,True,False,False,True,False,True,True,True,True,False,False
brain training for dogs,False,True,True,True,True,False,False,False,False,False,True
i hate him with a passion,False,True,True,True,True,False,False,False,False,False,True
i need help with potty training my  month old puppy,False,True,True,True,True,False,False,False,False,False,True
is my dog possibly going through depression,False,True,True,True,True,False,False,False,False,False,True
can somebody please help me love my dog,False,True,True,True,True,False,False,False,False,False,True
runaway dog  advice and vent,False,True,True,True,True,False,False,False,False,False,True
brain training for dogs,False,True,True,True,True,False,False,False,False,False,True
i hate him with a passion,False,True,True,True,True,False,False,False,False,False,True
puppy help  whining and negative behaviors,True,False,False,True,False,True,True,True,True,False,False
weenie acting scared randomly,False,True,True,True,True,False,False,False,False,False,True
horrifying puppy class experience im not sure how to feel about this i just need to share it,False,True,True,True,True,False,False,False,False,False,True
can somebody please help me love my dog,False,True,True,True,True,False,False,False,False,False,True
parking in front of the groomers every single time,False,True,True,True,True,False,False,False,False,True,True
my dog dislikes one of my housemates and snarls jumps on and is aggressive only to him,True,False,False,True,False,True,True,True,True,True,False
cmon now dont scroll without saying happy birthday to lucy,True,False,False,True,False,True,True,True,True,True,False
soren is so happy about his peice of bark,True,False,False,True,False,True,True,True,True,True,False
i miss you bubba,False,True,True,True,True,False,False,False,False,False,True
this guy seems to be very happy,True,False,False,True,False,True,True,True,True,True,False
it broke my heart to have to put him to sleep but he lived a long life of  years it broke my heart even worse to see him suffer as much as he did,False,True,True,True,True,False,False,False,False,False,True
we had to say goodbye to charlie last week,False,True,True,True,True,False,False,False,False,False,True
do you think shes happy with her hairdresser,True,False,False,True,False,True,True,True,True,True,False
healthy and happy play,True,False,False,True,False,True,True,True,True,True,False
ozzy pawsborne prince of barkness is a good happy boy,True,False,False,True,False,True,True,True,True,True,False
our happy girl leia bark vader,True,False,False,True,False,True,True,True,True,True,False
opinion on allowing your dog to misbehave,False,True,True,True,True,False,False,False,False,False,True
my best friend crossed the rainbow bridge last night,False,True,True,True,True,False,False,False,False,False,True
if you could ask your dog one question,True,False,False,True,False,True,True,True,True,True,False
this is shady it has been a year now since i lost my big guy he was such a good boy also my protector,True,False,False,True,False,True,True,True,True,False,False
goodbye ash,False,True,True,True,True,False,False,False,False,False,True
happy us national dog day,True,False,False,True,False,True,True,True,True,True,False
happy birthday,True,False,False,True,False,True,True,True,True,True,False
feeling torn,False,True,True,True,True,False,False,False,False,False,True
my neighbours bull terrier bit me today and drew blood,False,True,True,True,True,False,False,False,False,False,True
whats your dog dressing up as for halloween,True,False,False,True,False,True,True,True,True,True,False
is my dog suffering are we doing right by euthanizing him tomorrow,False,True,True,True,True,False,False,False,False,False,True
what breed is my dog,True,False,False,True,False,True,True,True,True,False,False
i hope you knew that i love you,False,True,True,True,True,False,False,False,False,False,True
chestnut my dog,True,False,False,True,False,True,True,True,True,False,False
extremely terrified and anxious dog,False,True,True,True,True,False,False,False,False,False,True
what breed for me,False,True,True,True,True,False,False,False,False,False,True
can anyone identify these breeds,False,True,True,True,True,False,False,False,False,True,True
dog sitting  puppy is biting and barking constantly  in need of help  advice,False,True,True,True,True,False,False,False,False,False,True
old dog dementia symptoms,False,True,True,True,True,False,False,False,False,False,True
my best friend,True,False,False,True,False,True,True,True,True,False,False
sophia loren is  today,True,False,False,True,False,True,True,True,True,True,False
sammy girl turned  today,True,False,False,True,False,True,True,True,True,True,False
should we adopt a second dog,False,True,True,True,True,False,False,False,False,False,True
shepherd mix,False,True,True,True,True,False,False,False,False,False,True
my mums supervet dog rusty,True,False,False,True,False,True,True,True,True,False,False
my sweet blue eye bandit,True,False,False,True,False,True,True,True,True,False,False
just wanted to share a happy story,True,False,False,True,False,True,True,True,True,False,False
i dont like how my roommates dogs treat my dog,False,True,True,True,True,False,False,False,False,False,True
dog holidays,False,True,True,True,True,False,False,False,False,False,True
does anyone know why my dog has selective fear of dogs,False,True,True,True,True,False,False,False,False,False,True
fabius th birthday,True,False,False,True,False,True,True,True,True,True,False
my dog passed away and i have so many questions,False,True,True,True,True,False,False,False,False,False,True
is it wrong of me to want another dog after my previous one passed away,False,True,True,True,True,False,False,False,False,False,True
dog breed recommendations,False,True,True,True,True,False,False,False,False,False,True
help choose our next dog,False,True,True,True,True,False,False,False,False,False,True
bark side of the moon outofthisworld dog antics,True,False,False,True,False,True,True,True,True,True,False
got the bundle now,True,False,False,True,False,True,True,True,True,False,False
kulfi just turned,True,False,False,True,False,True,True,True,True,True,False
i hope my childhood dog remembers me after long years,False,True,True,True,True,False,False,False,False,False,True
we had to say goodbye to charlie last week,False,True,True,True,True,False,False,False,False,False,True
rip hatsuko a dog that was loved and died being loved,False,True,True,True,True,False,False,False,False,False,True
how to say goodbye to my dog and get him familiar with adoptors,False,True,True,True,True,False,False,False,False,False,True
my neighbours bull terrier bit me today and drew blood,False,True,True,True,True,False,False,False,False,False,True
help am wakeup from puppy its my fault,False,True,True,True,True,False,False,False,False,False,True
i played a video of our dog bagel who passed away in jan lynn is watching and head bopping hearing her friend,True,False,False,True,False,True,True,True,True,True,False
extremely terrified and anxious dog,False,True,True,True,True,False,False,False,False,False,True
my silly boy,True,False,False,True,False,True,True,True,True,False,False
can anyone identify these breeds,False,True,True,True,True,False,False,False,False,True,True
help is my dog broken,False,True,True,True,True,False,False,False,False,False,True
im struggling with my reactive dog,False,True,True,True,True,False,False,False,False,True,True
storm anxiety,False,True,True,True,True,False,False,False,False,False,True
first time i came home after ruby passed away and the blinds being closed just made me cry,True,False,False,True,False,True,True,True,True,True,False
i dont like how my roommates dogs treat my dog,False,True,True,True,True,False,False,False,False,False,True
rainbow bridge,True,False,False,True,False,True,True,True,True,False,False
possibly my favorite cartoon,True,False,False,True,False,True,True,True,True,True,False
gdv,True,False,False,True,False,True,True,True,True,False,False
breed of this dog,True,False,False,True,False,True,True,True,True,True,False
question about training and discipline,False,True,True,True,True,False,False,False,False,False,True
eulogy  rant,False,True,True,True,True,False,False,False,False,False,True
my dog passed away and i have so many questions,False,True,True,True,True,False,False,False,False,False,True
grief  guilt about rehoming my dog,False,True,True,True,True,False,False,False,False,False,True
getting a family member to get over phobia of dogs,False,True,True,True,True,False,False,False,False,False,True
is it wrong of me to want another dog after my previous one passed away,False,True,True,True,True,False,False,False,False,False,True
got the bundle now,True,False,False,True,False,True,True,True,True,False,False
what dog breed is this read his full story,False,True,True,True,True,False,False,False,False,False,True
i hope my childhood dog remembers me after long years,False,True,True,True,True,False,False,False,False,False,True
how do i know if my dog is depressed,True,False,False,True,False,True,True,True,True,False,False
advice on dogs n cats,True,False,False,True,False,True,True,True,True,False,False
grief and guilt,False,True,True,True,True,False,False,False,False,False,True
neighbors dog barks,False,True,True,True,True,False,False,False,False,False,True
weird behaviour from my dog,False,True,True,True,True,False,False,False,False,True,True
can somebody please help me love my dog,False,True,True,True,True,False,False,False,False,False,True
i dont know what to do anymore,True,False,False,True,False,True,True,True,True,False,False
leaving my dog behind every time i go out breaks my heart  a ramblethought sharing,False,True,True,True,True,False,False,False,False,False,True
how do i calm my anxious shepherd mix dog,False,True,True,True,True,False,False,False,False,False,True
we got a new dog which our old dog does not seem to accept,False,True,True,True,True,False,False,False,False,False,True
need help with chihuahua,False,True,True,True,True,False,False,False,False,False,True
can second owners be enough,False,True,True,True,True,False,False,False,False,False,True
just barked,False,True,True,True,True,False,False,False,False,False,True
share your dog rescue story with me,False,True,True,True,True,False,False,False,False,False,True
what does your typical schedule look like help please,False,True,True,True,True,False,False,False,False,False,True
i need to return my shelter dog,False,True,True,True,True,False,False,False,False,False,True
houston shelter is euthanizing  dogs today,True,False,False,True,False,True,True,True,True,False,False
goodbye mosi,False,True,True,True,True,False,False,False,False,False,True
what breed is my dog,False,True,True,True,True,False,False,False,False,False,True
i came as a guest as soon as i came in he started barking wildly when i asked why the dog wouldnt shut up without making him feel loved he loves to be loved very much he wants to lay you down and lick you sometimes he gets excited when he sees guests and insulates his urine,True,False,False,True,False,True,True,True,True,True,False
she barks like that when she is excited we are going on a walk and she loves those,True,False,False,True,False,True,True,True,True,True,False
do your dogs get excited when they get packages,True,False,False,True,False,True,True,True,True,True,False
my best friend crossed the rainbow bridge last night,False,True,True,True,True,False,False,False,False,False,True
what is the most intelligent thing your dog can do,False,True,True,True,True,False,False,False,False,True,True
my dog attacked another dog,False,True,True,True,True,False,False,False,False,False,True
how to handle a mouthy dog,False,True,True,True,True,False,False,False,False,False,True
my dog is becoming aggressive since being attacked,False,True,True,True,True,False,False,False,False,False,True
weird behavior from other dogs,False,True,True,True,True,False,False,False,False,False,True
my dog got attacked and im not sure how to help,False,True,True,True,True,False,False,False,False,False,True
i hope you knew that i love you,False,True,True,True,True,False,False,False,False,False,True
senior dog with really bad habits is it possible to fix,False,True,True,True,True,False,False,False,False,False,True
can anyone help me figure out what breed my handsome boy might be,False,True,True,True,True,False,False,False,False,False,True
weenie acting scared randomly,False,True,True,True,True,False,False,False,False,False,True
help with barking,False,True,True,True,True,False,False,False,False,False,True
how do i be good with dogs,False,True,True,True,True,False,False,False,False,False,True
why does the older dog black doing,False,True,True,True,True,False,False,False,False,True,True
update on nova,False,True,True,True,True,False,False,False,False,False,True
need help,False,True,True,True,True,False,False,False,False,False,True
dog stretched eyelid,False,True,True,True,True,False,False,False,False,False,True
my dogs death,False,True,True,True,True,False,False,False,False,False,True
my dog passed away and i have so many questions,False,True,True,True,True,False,False,False,False,False,True
getting a family member to get over phobia of dogs,False,True,True,True,True,False,False,False,False,False,True
doggo jumps with excitement after seeing himself on the news,True,False,False,True,False,True,True,True,True,True,False
what do you think about a dog socialization app,False,True,True,True,True,False,False,False,False,False,True
i hope my childhood dog remembers me after long years,False,True,True,True,True,False,False,False,False,False,True
should i bring my senior country dog to the city with me,False,True,True,True,True,False,False,False,False,False,True
using a slip lead and a harness,False,True,True,True,True,False,False,False,False,False,True
dogs meeting kitten question,False,True,True,True,True,False,False,False,False,False,True
canine confessionthings only dog owners cam understand,False,True,True,True,True,False,False,False,False,False,True
small dogs stand up to the subreddit that hates dogs,False,True,True,True,True,False,False,False,False,False,True
