title,angry,anxious,bark,behavior_category_2,behavior_category_3,behavior_category_5,growl,lick,whine,relevance,scared
not exactly the update i wanted to give but heres the latest on pratt,False,True,True,True,True,False,False,False,False,False,True
goodbye my sweet girl,True,False,False,True,False,True,True,True,True,False,False
synced tail wags and happy smiles,True,False,False,True,False,True,True,True,True,True,False
raising your kids with good manners look like,True,False,False,True,False,True,True,True,True,True,False
i miss you bubba,False,True,True,True,True,False,False,False,False,False,True
tailwagging wisdom inspiring dog quotes and pure happiness dog quotes tshirt,True,False,False,True,False,True,True,True,True,True,False
from abandoned to adored buddy the shy pup who found a home at our construction yard update spoiler hes not a horse and not coydog,False,True,True,True,True,False,False,False,False,False,True
happy boy tail wags,True,False,False,True,False,True,True,True,True,True,False
im scared of my dog,True,False,False,True,False,True,True,True,True,False,False
im crying inside is it my fault,False,True,True,True,True,False,False,False,False,False,True
happy dog,True,False,False,True,False,True,True,True,True,True,False
happy dream,True,False,False,True,False,True,True,True,True,True,False
happy th birthday to ducky,True,False,False,True,False,True,True,True,True,True,False
milo is doing all the emotes for the treat he only has three unlocked,True,False,False,True,False,True,True,True,True,False,False
henry  me,False,True,True,True,True,False,False,False,False,False,True
i hope you knew that i love you,False,True,True,True,True,False,False,False,False,False,True
accuse aggression after lyme booster,False,True,True,True,True,False,False,False,False,True,True
chestnut my dog,True,False,False,True,False,True,True,True,True,False,False
new behavior has me curious,True,False,False,True,False,True,True,True,True,False,False
tail wagging but only to oneself,False,True,True,True,True,False,False,False,False,False,True
help choosing a hypoallergenic dog please,False,True,True,True,True,False,False,False,False,False,True
just wanted to share a happy story,True,False,False,True,False,True,True,True,True,False,False
elderly dog with neurological issues,False,True,True,True,True,False,False,False,False,False,True
please help me with my first dog yo rescued  weeks ago w distemper and ehrlichiosis nonregenerative anemia and kidney damage,False,True,True,True,True,False,False,False,False,False,True
please help me choose a name for a new dog training business,False,True,True,True,True,False,False,False,False,False,True
remembering my beloved coco a tribute to a cherished companion,False,True,True,True,True,False,False,False,False,False,True
the acting when puppy loves kids,False,True,True,True,True,False,False,False,False,False,True
such a best boy,True,False,False,True,False,True,True,True,True,True,False
chunky wiggle butt trot,True,False,False,True,False,True,True,True,True,False,False
he is happy with his toy,True,False,False,True,False,True,True,True,True,True,False
fascinating facts about dogs,False,True,True,True,True,False,False,False,False,False,True
former captain of indian cricket team celebrating his birthday,True,False,False,True,False,True,True,True,True,True,False
the video of my broken dog,True,False,False,True,False,True,True,True,True,True,False
ks emotional farewell,True,False,False,True,False,True,True,True,True,True,False
your ultimate guide to dogs care in the usa,False,True,True,True,True,False,False,False,False,False,True
we had an understanding,True,False,False,True,False,True,True,True,True,False,False
wagging tail,True,False,False,True,False,True,True,True,True,True,False
common myths about dogs,False,True,True,True,True,False,False,False,False,False,True
most adorable montage,True,False,False,True,False,True,True,True,True,True,False
maxwell had a little too much fun at the park and got messy but hes still a happy boy,True,False,False,True,False,True,True,True,True,True,False
we sure loved our little noel,True,False,False,True,False,True,True,True,True,False,False
arti getting some fibre,True,False,False,True,False,True,True,True,True,True,False
anyone elses dog do this,False,True,True,True,True,False,False,False,False,True,True
this makes my day every time mini golden doodle cuteness,True,False,False,True,False,True,True,True,True,True,False
oc took my pups to see the sea for the first time,True,False,False,True,False,True,True,True,True,True,False
our dog showing off how good he is in a trailer,True,False,False,True,False,True,True,True,True,True,False
watch our video and subscribe to the our channel,True,False,False,True,False,True,True,True,True,True,False
renji soul dog,False,True,True,True,True,False,False,False,False,False,True
a good girl who keep my wallet,True,False,False,True,False,True,True,True,True,True,False
loosing my best friend,True,False,False,True,False,True,True,True,True,False,False
lost my dog of  years last nightthe goodest girl to me,False,True,True,True,True,False,False,False,False,False,True
im crying inside is it my fault,False,True,True,True,True,False,False,False,False,False,True
gdv,True,False,False,True,False,True,True,True,True,False,False
dog dominace problem,False,True,True,True,True,False,False,False,False,False,True
remembering my beloved coco a tribute to a cherished companion,False,True,True,True,True,False,False,False,False,False,True
the acting when puppy loves kids,False,True,True,True,True,False,False,False,False,False,True
sensitive content how to cope with a dog getting older,False,True,True,True,True,False,False,False,False,True,True
any ideas what could be wrong,False,True,True,True,True,False,False,False,False,False,True
am i bad dog owner,False,True,True,True,True,False,False,False,False,False,True
the leash goes both ways,False,True,True,True,True,False,False,False,False,False,True
how to make your dog love you,False,True,True,True,True,False,False,False,False,False,True
from abandoned to adored buddy the shy pup who found a home at our construction yard update spoiler hes not a horse and not coydog,False,True,True,True,True,False,False,False,False,False,True
new dog bed day so very excited cant even see his tail its wagging so fast,True,False,False,True,False,True,True,True,True,True,False
i hope you knew that i love you,False,True,True,True,True,False,False,False,False,False,True
new behavior has me curious,True,False,False,True,False,True,True,True,True,False,False
thought id give you guys an update on russ hes wagging his tail alot now enjoying his exercise outside and is starting to open up more and more thanks for all the advice everyone,False,True,True,True,True,False,False,False,False,False,True
my puppy doesnt get excited for me but does for others what am i doing wrong,False,True,True,True,True,False,False,False,False,False,True
how cute is this dog so excited about the baby,True,False,False,True,False,True,True,True,True,True,False
fascinating facts about dogs,False,True,True,True,True,False,False,False,False,False,True
tail tucking,False,True,True,True,True,False,False,False,False,False,True
anyone elses dog do this,False,True,True,True,True,False,False,False,False,True,True
dogs meeting kitten question,False,True,True,True,True,False,False,False,False,False,True
canine confessionthings only dog owners cam understand,False,True,True,True,True,False,False,False,False,False,True
i have no idea what i am doing wrong,False,True,True,True,True,False,False,False,False,False,True
training tips for your new dog,False,True,True,True,True,False,False,False,False,False,True
advice for a novice dog sister sorry this is very long but i just want the best for my new brother your time and advice is appreciated thank you,False,True,True,True,True,False,False,False,False,False,True
foster dog tips,False,True,True,True,True,False,False,False,False,False,True
having friends over with their dogs when you also have a dog,False,True,True,True,True,False,False,False,False,False,True
the leash goes both ways,False,True,True,True,True,False,False,False,False,False,True
from abandoned to adored buddy the shy pup who found a home at our construction yard update spoiler hes not a horse and not coydog,False,True,True,True,True,False,False,False,False,False,True
im scared of my dog,True,False,False,True,False,True,True,True,True,False,False
accuse aggression after lyme booster,False,True,True,True,True,False,False,False,False,True,True
urgently need help,False,True,True,True,True,False,False,False,False,False,True
help my dog hates my brother,False,True,True,True,True,False,False,False,False,False,True
just wanted to share a happy story,True,False,False,True,False,True,True,True,True,False,False
elderly dog with neurological issues,False,True,True,True,True,False,False,False,False,False,True
to the sweetest doggo,False,True,True,True,True,False,False,False,False,False,True
we had an understanding,True,False,False,True,False,True,True,True,True,False,False
month old cane corso unusual behaviour,True,False,False,True,False,True,True,True,True,False,False
advice for a novice dog sister sorry this is very long but i just want the best for my new brother your time and advice is appreciated thank you,False,True,True,True,True,False,False,False,False,False,True
new male dog wants to hump my female dog follows her everywhere wont leave her alone,False,True,True,True,True,False,False,False,False,False,True
help my dog cant recognize my other dog after grooming,False,True,True,True,True,False,False,False,False,False,True
anyone elses dog do this,False,True,True,True,True,False,False,False,False,True,True
can dogs really sense your fear,False,True,True,True,True,False,False,False,False,False,True
loosing my best friend,True,False,False,True,False,True,True,True,True,False,False
my best friend,True,False,False,True,False,True,True,True,True,False,False
farewell diesel,False,True,True,True,True,False,False,False,False,False,True
scared  month old puppy shebas final notice expired on nov  and she can be euthanized at any time she and her bonded sister were surrendered due to landlord her sister was adopted and she was left behind she needs a home or foster immediately to save her life could that be you,False,True,True,True,True,False,False,False,False,False,True
glimmer is super friendly  very social with other dogs  so sweet with humans but this perfect boy will be put down at downey acc tomorrow morning  because his final notice expired  the shelter is full he needs a loving forever home  or a foster immediately to save his life is it you,False,True,True,True,True,False,False,False,False,False,True
to the sweetest doggo,False,True,True,True,True,False,False,False,False,False,True
training tips for your new dog,False,True,True,True,True,False,False,False,False,False,True
the leash goes both ways,False,True,True,True,True,False,False,False,False,False,True
want to help me name my new dog,False,True,True,True,True,False,False,False,False,False,True
farewell diesel,False,True,True,True,True,False,False,False,False,False,True
it has been almost  months since you left me and i still cry myself to sleep at night,False,True,True,True,True,False,False,False,False,False,True
from abandoned to adored buddy the shy pup who found a home at our construction yard update spoiler hes not a horse and not coydog,False,True,True,True,True,False,False,False,False,False,True
goofy on the move,True,False,False,True,False,True,True,True,True,True,False
play slapping my dog,False,True,True,True,True,False,False,False,False,False,True
grieving lost of my dog,False,True,True,True,True,False,False,False,False,False,True
glimmer is super friendly  very social with other dogs  so sweet with humans but this perfect boy will be put down at downey acc tomorrow morning  because his final notice expired  the shelter is full he needs a loving forever home  or a foster immediately to save his life is it you,False,True,True,True,True,False,False,False,False,False,True
happy th birthday to ducky,True,False,False,True,False,True,True,True,True,True,False
henry  me,False,True,True,True,True,False,False,False,False,False,True
chestnut my dog,True,False,False,True,False,True,True,True,True,False,False
my puppy doesnt get excited for me but does for others what am i doing wrong,False,True,True,True,True,False,False,False,False,False,True
good boy spotted,True,False,False,True,False,True,True,True,True,False,False
dog dominace problem,False,True,True,True,True,False,False,False,False,False,True
please help me choose a name for a new dog training business,False,True,True,True,True,False,False,False,False,False,True
unveiling the heartwarming story of my beloved labrador,False,True,True,True,True,False,False,False,False,False,True
missing my furry friend,False,True,True,True,True,False,False,False,False,False,True
remembering my beloved coco a tribute to a cherished companion,False,True,True,True,True,False,False,False,False,False,True
the acting when puppy loves kids,False,True,True,True,True,False,False,False,False,False,True
play or fight,True,False,False,True,False,True,True,True,True,False,False
i love playing with her,True,False,False,True,False,True,True,True,True,True,False
my husky and baby playing,True,False,False,True,False,True,True,True,True,True,False
enternal love bond,False,True,True,True,True,False,False,False,False,False,True
oc arya and sandor pups play fighting,True,False,False,True,False,True,True,True,True,True,False
more videos of dogs playing with a rescue dog,True,False,False,True,False,True,True,True,True,True,False
my dog playing with his friends,True,False,False,True,False,True,True,True,True,True,False
spaniel shenanigans,False,True,True,True,True,False,False,False,False,False,True
playing or aggressive,True,False,False,True,False,True,True,True,True,False,False
any ideas would be amazing,True,False,False,True,False,True,True,True,True,False,False
dogs meeting kitten question,False,True,True,True,True,False,False,False,False,False,True
puppies father has started spraying in the house  help,False,True,True,True,True,False,False,False,False,False,True
i have no idea what i am doing wrong,False,True,True,True,True,False,False,False,False,False,True
aggressive behavior towards strangers and other dogs,False,True,True,True,True,False,False,False,False,False,True
how to train your dog at home,False,True,True,True,True,False,False,False,False,False,True
how to train your dog at home,False,True,True,True,True,False,False,False,False,False,True
loosing my best friend,True,False,False,True,False,True,True,True,True,False,False
my best friend,True,False,False,True,False,True,True,True,True,False,False
training tips for your new dog,False,True,True,True,True,False,False,False,False,False,True
advice for a novice dog sister sorry this is very long but i just want the best for my new brother your time and advice is appreciated thank you,False,True,True,True,True,False,False,False,False,False,True
am i bad dog owner,False,True,True,True,True,False,False,False,False,False,True
foster dog tips,False,True,True,True,True,False,False,False,False,False,True
new male dog wants to hump my female dog follows her everywhere wont leave her alone,False,True,True,True,True,False,False,False,False,False,True
the leash goes both ways,False,True,True,True,True,False,False,False,False,False,True
help put moe to rest,False,True,True,True,True,False,False,False,False,False,True
my dog doesnt play with other dogs,True,False,False,True,False,True,True,True,True,False,False
how to make your dog love you,False,True,True,True,True,False,False,False,False,False,True
post buddha surgery thank you everyone,False,True,True,True,True,False,False,False,False,False,True
new behavior has me curious,True,False,False,True,False,True,True,True,True,False,False
is oakley a pure cocker spaniel or mixed breed,False,True,True,True,True,False,False,False,False,True,True
saber  the gentle giant a memorial post for the sweetest boy to ever live,False,True,True,True,True,False,False,False,False,False,True
remembering my beloved coco a tribute to a cherished companion,False,True,True,True,True,False,False,False,False,False,True
adopted this lovable goof ball a few months ago any idea the breed,False,True,True,True,True,False,False,False,False,False,True
any ideas what could be wrong,False,True,True,True,True,False,False,False,False,False,True
sudden passing of my yo pup,False,True,True,True,True,False,False,False,False,False,True
my puppy doesnt get excited for me but does for others what am i doing wrong,False,True,True,True,True,False,False,False,False,False,True
i have no idea what i am doing wrong,False,True,True,True,True,False,False,False,False,False,True
training tips for your new dog,False,True,True,True,True,False,False,False,False,False,True
the leash goes both ways,False,True,True,True,True,False,False,False,False,False,True
i hope you knew that i love you,False,True,True,True,True,False,False,False,False,False,True
can dogs really sense your fear,False,True,True,True,True,False,False,False,False,False,True
my dogs guilty face makes it hard to stay mad,True,False,False,True,False,True,True,True,True,True,False
took my dog into court today,False,True,True,True,True,False,False,False,False,False,True
it has been almost  months since you left me and i still cry myself to sleep at night,False,True,True,True,True,False,False,False,False,False,True
loosing my best friend,True,False,False,True,False,True,True,True,True,False,False
my best friend,True,False,False,True,False,True,True,True,True,False,False
why my dog crashing out for no reason,False,True,True,True,True,False,False,False,False,False,True
our pup saved our lives,True,False,False,True,False,True,True,True,True,False,False
canine confessionthings only dog owners cam understand,False,True,True,True,True,False,False,False,False,False,True
how to train your dog at home,False,True,True,True,True,False,False,False,False,False,True
how to train your dog at home,False,True,True,True,True,False,False,False,False,False,True
advice for a novice dog sister sorry this is very long but i just want the best for my new brother your time and advice is appreciated thank you,False,True,True,True,True,False,False,False,False,False,True
how to make your dog love you,False,True,True,True,True,False,False,False,False,False,True
my dog understands malicious compliance,True,False,False,True,False,True,True,True,True,False,False
scared  month old puppy shebas final notice expired on nov  and she can be euthanized at any time she and her bonded sister were surrendered due to landlord her sister was adopted and she was left behind she needs a home or foster immediately to save her life could that be you,False,True,True,True,True,False,False,False,False,False,True
glimmer is super friendly  very social with other dogs  so sweet with humans but this perfect boy will be put down at downey acc tomorrow morning  because his final notice expired  the shelter is full he needs a loving forever home  or a foster immediately to save his life is it you,False,True,True,True,True,False,False,False,False,False,True
henry  me,False,True,True,True,True,False,False,False,False,False,True
chestnut my dog,True,False,False,True,False,True,True,True,True,False,False
kaia my service dog and me at disneyland,False,True,True,True,True,False,False,False,False,False,True
my puppy doesnt get excited for me but does for others what am i doing wrong,False,True,True,True,True,False,False,False,False,False,True
aggressive behavior towards strangers and other dogs,False,True,True,True,True,False,False,False,False,False,True
advice for a novice dog sister sorry this is very long but i just want the best for my new brother your time and advice is appreciated thank you,False,True,True,True,True,False,False,False,False,False,True
cutest dog breeds,False,True,True,True,True,False,False,False,False,False,True
having friends over with their dogs when you also have a dog,False,True,True,True,True,False,False,False,False,False,True
the leash goes both ways,False,True,True,True,True,False,False,False,False,False,True
farewell diesel,False,True,True,True,True,False,False,False,False,False,True
sudden passing of my yo pup,False,True,True,True,True,False,False,False,False,False,True
my dog understands malicious compliance,True,False,False,True,False,True,True,True,True,False,False
dog dominace problem,False,True,True,True,True,False,False,False,False,False,True
please help me choose a name for a new dog training business,False,True,True,True,True,False,False,False,False,False,True
unveiling the heartwarming story of my beloved labrador,False,True,True,True,True,False,False,False,False,False,True
missing my furry friend,False,True,True,True,True,False,False,False,False,False,True
the acting when puppy loves kids,False,True,True,True,True,False,False,False,False,False,True
do dogs really need people,False,True,True,True,True,False,False,False,False,False,True
fascinating facts about dogs,False,True,True,True,True,False,False,False,False,False,True
your ultimate guide to dogs care in the usa,False,True,True,True,True,False,False,False,False,False,True
we had an understanding,True,False,False,True,False,True,True,True,True,False,False
common myths about dogs,False,True,True,True,True,False,False,False,False,False,True
dog rant,True,False,False,True,False,True,True,True,True,False,False
begging ass dog,False,True,True,True,True,False,False,False,False,True,True
canine confessionthings only dog owners cam understand,False,True,True,True,True,False,False,False,False,False,True
how to train your dog at home,False,True,True,True,True,False,False,False,False,False,True
how to train your dog at home,False,True,True,True,True,False,False,False,False,False,True
the leash goes both ways,False,True,True,True,True,False,False,False,False,False,True
kaia my service dog and me at disneyland,False,True,True,True,True,False,False,False,False,False,True
help my dog hates my brother,False,True,True,True,True,False,False,False,False,False,True
dog rant,True,False,False,True,False,True,True,True,True,False,False
im crying inside is it my fault,False,True,True,True,True,False,False,False,False,False,True
we had an understanding,True,False,False,True,False,True,True,True,True,False,False
seeking advice  receiving a note at the street parking,False,True,True,True,True,False,False,False,False,False,True
puppies father has started spraying in the house  help,False,True,True,True,True,False,False,False,False,False,True
training tips for your new dog,False,True,True,True,True,False,False,False,False,False,True
good dog is good dog,False,True,True,True,True,False,False,False,False,False,True
weenie acting scared randomly,False,True,True,True,True,False,False,False,False,False,True
good dog is good dog,False,True,True,True,True,False,False,False,False,False,True
help  sudden change in behavior,False,True,True,True,True,False,False,False,False,False,True
training tips for your new dog,False,True,True,True,True,False,False,False,False,False,True
weenie acting scared randomly,False,True,True,True,True,False,False,False,False,False,True
training tips for your new dog,False,True,True,True,True,False,False,False,False,False,True
good dog is good dog,False,True,True,True,True,False,False,False,False,False,True
training tips for your new dog,False,True,True,True,True,False,False,False,False,False,True
training tips for your new dog,False,True,True,True,True,False,False,False,False,False,True
weenie acting scared randomly,False,True,True,True,True,False,False,False,False,False,True
help  sudden change in behavior,False,True,True,True,True,False,False,False,False,False,True
weenie acting scared randomly,False,True,True,True,True,False,False,False,False,False,True
training tips for your new dog,False,True,True,True,True,False,False,False,False,False,True
farewell to my best friend,False,True,True,True,True,False,False,False,False,False,True
ran into previous owner my heart is broken,False,True,True,True,True,False,False,False,False,False,True
my boy is gone  suspected neurological condition,False,True,True,True,True,False,False,False,False,False,True
all i had ever wanted was a dog who would sleep in my lap while i read and lick my neck and bring me the ball to throw  times in a row i thought a dog would be the key to perfect happiness and i was right we are perfectly happy,True,False,False,True,False,True,True,True,True,True,False
it broke my heart to have to put him to sleep but he lived a long life of  years it broke my heart even worse to see him suffer as much as he did,False,True,True,True,True,False,False,False,False,False,True
we had to say goodbye to charlie last week,False,True,True,True,True,False,False,False,False,False,True
rip tuppy,False,True,True,True,True,False,False,False,False,False,True
ziggy very happy dog loves to lick faces,True,False,False,True,False,True,True,True,True,True,False
accuracy is important,True,False,False,True,False,True,True,True,True,True,False
what should i do with an overly submissive dog,False,True,True,True,True,False,False,False,False,False,True
dog nonstop licking right paw,False,True,True,True,True,False,False,False,False,False,True
jackass got a bath,True,False,False,True,False,True,True,True,True,True,False
i hope you knew that i love you,False,True,True,True,True,False,False,False,False,False,True
when god made dogs,False,True,True,True,True,False,False,False,False,False,True
my baby golden makes me happy,True,False,False,True,False,True,True,True,True,True,False
